{
  "$id": "https://local.schemas/index.schema.json",
  "$schema": "http://json-schema.org/draft-07/schema#",
  "type": "object",
  "required": [
    "version",
    "generated_at",
    "modules",
    "docs"
  ],
  "properties": {
    "$schema": {
      "type": "string"
    },
    "version": {
      "type": "integer",
      "minimum": 1
    },
    "generated_at": {
      "$ref": "https://local.schemas/common.schema.json#/definitions/iso_date"
    },
    "modules": {
      "type": "array",
      "items": {
        "type": "object",
        "required": [
          "name",
          "path",
          "tasks_file"
        ],
        "properties": {
          "name": {
            "type": "string"
          },
          "path": {
            "type": "string"
          },
          "tasks_file": {
            "type": "string"
          },
          "docs": {
            "type": "array",
            "items": {
              "type": "object",
              "required": [
                "file"
              ],
              "properties": {
                "file": {
                  "type": "string"
                },
                "anchor": {
                  "type": "string"
                }
              }
            }
          }
        }
      }
    },
    "docs": {
      "type": "array",
      "items": {
        "type": "object",
        "required": [
          "file"
        ],
        "properties": {
          "file": {
            "type": "string"
          },
          "title": {
            "type": "string"
          }
        }
      }
    }
  },
  "additionalProperties": false
}