{
  "$schema": "schemas/index.schema.json",
  "version": 1,
  "generated_at": "scan",
  "modules": [
    {
      "name": "agents_core",
      "path": "src/agents_core",
      "tasks_file": ".agents/modules/agents_core/tasks.json"
    },
    {
      "name": "resources",
      "path": "src/agents_core/resources",
      "tasks_file": ".agents/modules/resources/tasks.json"
    },
    {
      "name": "schemas",
      "path": "src/agents_core/resources/schemas",
      "tasks_file": ".agents/modules/schemas/tasks.json"
    },
    {
      "name": "templates",
      "path": "src/agents_core/resources/templates",
      "tasks_file": ".agents/modules/templates/tasks.json"
    }
  ],
  "docs": []
}
